{
  "schema_version": 2,
  "kind": "environment-resolved",
  "status": "not_deployed",
  "request_sha256": null,
  "provisional_sha256": null,
  "deployment_id": null,
  "environment_id": null,
  "created_at": null,
  "infra": null,
  "aws": null,
  "kubernetes": null,
  "kafka": null,
  "datastores": null,
  "endpoints": null,
  "access": null,
  "lock": null,
  "observability": null,
  "readiness": null,
  "cleanup_inventory": [],
  "artifacts": [],
  "errors": []
}
